{
  "meta": {
    "title": "AI / LLM Threat Landscape 2026",
    "as_of": "2026-10-06",
    "scope": "Cyber threat intelligence focused on AI, LLM, GenAI and agentic systems",
    "methodology": "Evidence-first synthesis using primary vendor, standards-body and research sources. Metrics retain their original population/time window and are not generalized beyond it."
  },
  "key_metrics": [
    {
      "id": "METRIC-WEF-AI-DRIVER",
      "name": "AI expected to be the biggest force shaping cybersecurity in 2026",
      "value": 94,
      "unit": "percent of survey respondents",
      "timeframe": "WEF Global Cybersecurity Outlook 2026",
      "confidence": "confirmed",
      "source": {
        "publisher": "World Economic Forum",
        "grade": "A",
        "url": "https://www.weforum.org/publications/global-cybersecurity-outlook-2026/in-full/executive-summary-6efae97d74/"
      }
    },
    {
      "id": "METRIC-WEF-AI-VULNS",
      "name": "Respondents identifying AI-related vulnerabilities as the fastest-growing cyber risk during 2025",
      "value": 87,
      "unit": "percent of respondents",
      "timeframe": "2025 observations reported in WEF 2026 outlook",
      "confidence": "confirmed",
      "source": {
        "publisher": "World Economic Forum",
        "grade": "A",
        "url": "https://www.weforum.org/publications/global-cybersecurity-outlook-2026/in-full/executive-summary-6efae97d74/"
      }
    },
    {
      "id": "METRIC-CP-WEEKLY-ATTACKS",
      "name": "Average weekly cyber attacks per organization",
      "value": 1968,
      "unit": "attacks per organization per week",
      "timeframe": "2025",
      "confidence": "confirmed",
      "source": {
        "publisher": "Check Point",
        "grade": "A",
        "url": "https://www.checkpoint.com/kr/press-releases/check-point-softwares-2026-cyber-security-report-shows-global-attacks-reach-record-levels-as-ai-accelerates-the-threat-landscape/"
      }
    },
    {
      "id": "METRIC-CS-AGENT-LEADS",
      "name": "Growth rate of AI-agent-triggered detection leads relative to human-triggered leads",
      "value": 2.5,
      "unit": "times",
      "timeframe": "parts of Q1 2026",
      "confidence": "confirmed",
      "source": {
        "publisher": "CrowdStrike",
        "grade": "A",
        "url": "https://www.crowdstrike.com/en-us/press-releases/crowdstrike-2026-threat-hunting-report/"
      }
    },
    {
      "id": "METRIC-CS-CLOUD-ECRIME",
      "name": "Increase in cloud-conscious eCrime activity",
      "value": 171,
      "unit": "percent increase",
      "timeframe": "CrowdStrike 2026 Threat Hunting Report period",
      "confidence": "confirmed",
      "source": {
        "publisher": "CrowdStrike",
        "grade": "A",
        "url": "https://www.crowdstrike.com/en-us/press-releases/crowdstrike-2026-threat-hunting-report/"
      }
    },
    {
      "id": "METRIC-CS-NPM",
      "name": "Share of identified software registry threats involving malicious npm packages",
      "value": 87,
      "unit": "percent",
      "timeframe": "1H 2026",
      "confidence": "confirmed",
      "source": {
        "publisher": "CrowdStrike",
        "grade": "A",
        "url": "https://www.crowdstrike.com/en-us/blog/crowdstrike-2026-threat-hunting-report/"
      }
    },
    {
      "id": "METRIC-CS-EXPLOIT-48H",
      "name": "Observed exploitation of vulnerabilities with public PoC occurring within 48 hours",
      "value": 88,
      "unit": "percent",
      "timeframe": "1H 2026",
      "confidence": "confirmed",
      "source": {
        "publisher": "CrowdStrike",
        "grade": "A",
        "url": "https://www.crowdstrike.com/en-us/press-releases/crowdstrike-2026-threat-hunting-report/"
      }
    },
    {
      "id": "METRIC-FORTINET-RANSOMWARE-VICTIMS",
      "name": "Confirmed ransomware victims identified by FortiRecon",
      "value": 7831,
      "unit": "victims",
      "timeframe": "2025 activity reported in 2026",
      "confidence": "confirmed",
      "source": {
        "publisher": "Fortinet",
        "grade": "A",
        "url": "https://investor.fortinet.com/news-releases/news-release-details/fortinet-2026-global-threat-landscape-report-reveals-surge-ai"
      }
    },
    {
      "id": "METRIC-FORTINET-RANSOMWARE-YOY",
      "name": "Increase in confirmed ransomware victims in Fortinet dataset",
      "value": 389,
      "unit": "percent YoY",
      "timeframe": "2025 vs prior report",
      "confidence": "confirmed",
      "source": {
        "publisher": "Fortinet",
        "grade": "A",
        "url": "https://investor.fortinet.com/news-releases/news-release-details/fortinet-2026-global-threat-landscape-report-reveals-surge-ai"
      }
    },
    {
      "id": "METRIC-ZSCALER-EXFIL",
      "name": "Ransomware-associated data theft measured by Zscaler",
      "value": 896.2,
      "unit": "terabytes",
      "timeframe": "2026 report measurement period",
      "confidence": "confirmed",
      "source": {
        "publisher": "Zscaler ThreatLabz",
        "grade": "A",
        "url": "https://www.zscaler.com/press/new-zscaler-report-reveals-ai-assisted-attackers-move-massive-data-theft-executive-targeting"
      }
    },
    {
      "id": "METRIC-ZSCALER-PAYMENTS",
      "name": "Blockchain transactions associated with ransomware payments",
      "value": 328,
      "unit": "USD millions",
      "timeframe": "2026 report measurement period",
      "confidence": "confirmed",
      "source": {
        "publisher": "Zscaler ThreatLabz",
        "grade": "A",
        "url": "https://www.zscaler.com/press/new-zscaler-report-reveals-ai-assisted-attackers-move-massive-data-theft-executive-targeting"
      }
    },
    {
      "id": "METRIC-CP-HIGHRISK-PROMPTS",
      "name": "Share of GenAI prompts classified high-risk by Check Point",
      "value": {
        "from": 2,
        "to": 4
      },
      "unit": "percent",
      "timeframe": "one-year change reported in 2026",
      "confidence": "confirmed",
      "source": {
        "publisher": "Check Point Research",
        "grade": "A",
        "url": "https://research.checkpoint.com/2026/ai-security-report-2026/"
      }
    },
    {
      "id": "METRIC-CP-AI-APPS",
      "name": "Average AI applications used by an organization per month",
      "value": 10,
      "unit": "applications per month",
      "timeframe": "2026 report",
      "confidence": "confirmed",
      "source": {
        "publisher": "Check Point Research",
        "grade": "A",
        "url": "https://research.checkpoint.com/2026/ai-security-report-2026/"
      }
    },
    {
      "id": "METRIC-CP-IPI",
      "name": "Increase in detections of longer malicious prompt-injection payloads",
      "value": 5,
      "unit": "approximately times",
      "timeframe": "March-May 2026",
      "confidence": "confirmed",
      "source": {
        "publisher": "Check Point Research",
        "grade": "A",
        "url": "https://research.checkpoint.com/2026/ai-security-report-2026/"
      }
    },
    {
      "id": "METRIC-IBM-SUPPLYCHAIN",
      "name": "Increase in major supply-chain and third-party incidents since 2020",
      "value": 4,
      "unit": "nearly times",
      "timeframe": "2020-2025",
      "confidence": "confirmed",
      "source": {
        "publisher": "IBM X-Force",
        "grade": "A",
        "url": "https://www.ibm.com/think/x-force/threat-intelligence-index-2026-securing-identities-ai-detection-risk-management"
      }
    },
    {
      "id": "METRIC-GTIG-6H-HARVEST",
      "name": "Time for an autonomous multi-agent framework to plan, build and run a mass credential harvest (upper bound)",
      "value": 6,
      "unit": "hours (less than)",
      "timeframe": "GTIG AI Threat Tracker, 2026-09-08",
      "confidence": "confirmed",
      "source": {
        "publisher": "Google Threat Intelligence Group",
        "grade": "A",
        "url": "https://cloud.google.com/blog/topics/threat-intelligence/from-prompting-to-autonomy-the-evolution-of-adversarial-ai"
      }
    },
    {
      "id": "METRIC-GTIG-DISTILL",
      "name": "Size of the largest observed distillation campaigns against Google models",
      "value": 100000000,
      "unit": "prompts (some campaigns exceed)",
      "timeframe": "Feb-Sep 2026",
      "confidence": "confirmed",
      "source": {
        "publisher": "Google Threat Intelligence Group",
        "grade": "A",
        "url": "https://cloud.google.com/blog/topics/threat-intelligence/from-prompting-to-autonomy-the-evolution-of-adversarial-ai"
      }
    },
    {
      "id": "METRIC-GTIG-RECON-SECRETS",
      "name": "Harvested secrets managed in an exposed attacker 'Recon' dashboard",
      "value": 23800,
      "unit": "secrets (over), incl. cloud and AI API keys",
      "timeframe": "GTIG AI Threat Tracker, 2026-09-08",
      "confidence": "confirmed",
      "source": {
        "publisher": "Google Threat Intelligence Group",
        "grade": "A",
        "url": "https://cloud.google.com/blog/topics/threat-intelligence/from-prompting-to-autonomy-the-evolution-of-adversarial-ai"
      }
    }
  ],
  "domains": [
    {
      "id": "LANDSCAPE-AI-OPERATOR",
      "name": "AI as active operator",
      "trend": "rising",
      "confidence": "high",
      "summary": "Public reporting now includes campaigns and malware where AI participates in live execution, task chaining or runtime decision-making rather than only preparation.",
      "signals": [
        "agent-triggered detection growth",
        "AI-orchestrated intrusion reporting",
        "runtime LLM command generation"
      ],
      "defensive_focus": [
        "agent action telemetry",
        "tool authorization",
        "AI egress visibility",
        "human/policy checkpoints"
      ]
    },
    {
      "id": "LANDSCAPE-AI-ENABLER",
      "name": "AI as offensive force multiplier",
      "trend": "rising",
      "confidence": "confirmed",